{
  "$schema": "https://json-schema.org/draft/2020-12/schema",
  "$id": "https://github.com/vmforge/porter-images/schema/image.schema.json",
  "title": "Porter Image Definition",
  "description": "Declarative definition of a Porter image: source OCI image, base OS, resources, and how it is assembled into a Firecracker-bootable rootfs.",
  "type": "object",
  "required": ["schemaVersion", "name", "source", "versions"],
  "properties": {
    "schemaVersion": { "type": "string", "const": "1" },
    "name": {
      "type": "string",
      "pattern": "^[a-z0-9]([a-z0-9-]*[a-z0-9])?$",
      "description": "Short slug, e.g. 'nginx'. Used by 'porter image install <name>'."
    },
    "title": { "type": "string" },
    "description": { "type": "string" },
    "type": {
      "type": "string",
      "enum": ["base", "application"],
      "default": "application",
      "description": "base = OS foundation (kernel + init + guest runtime; no ports/volumes). application = built on top of a base."
    },
    "official": { "type": "boolean", "default": true, "description": "Maintained by VMForge (vs community)." },
    "arch": {
      "type": "array",
      "items": { "type": "string", "enum": ["x86_64", "aarch64"] },
      "minItems": 1,
      "description": "Architectures this image is built for."
    },
    "category": {
      "type": "string",
      "enum": ["base", "web", "database", "cache", "messaging", "search", "storage", "security", "devtools", "observability", "ai", "networking", "selfhosted", "other"]
    },
    "icon": { "type": "string", "description": "URL or asset-relative path to an icon." },
    "source": {
      "type": "object",
      "required": ["kind", "reference"],
      "properties": {
        "kind": {
          "type": "string",
          "enum": ["docker-hub", "ghcr", "oci", "github-release", "dockerfile", "compose"],
          "description": "github-release: prebuilt artifacts from a GitHub repo's releases (e.g. official Firecracker CI microvm images). dockerfile: build from a Dockerfile in this image's directory. compose: build from a compose.yml in this image's directory."
        },
        "reference": {
          "type": "string",
          "description": "For registries: OCI reference WITHOUT tag. For github-release: 'owner/repo'. For dockerfile/compose: path to the build file relative to repo root (e.g. 'images/myapp/Dockerfile')."
        }
      }
    },
    "base": {
      "type": "object",
      "description": "Omit for type=base images.",
      "properties": {
        "name": { "type": "string", "enum": ["ubuntu", "alpine", "debian", "fedora", "rocky", "alma", "arch", "custom"] },
        "ref": { "type": "string", "description": "Base artifact ref, e.g. 'bases/alpine/3.20'." }
      }
    },
    "runtime": {
      "type": "object",
      "properties": {
        "guestRuntime": { "type": "boolean", "default": true, "description": "Inject the Porter guest agent (health hooks, config-drive handling)." }
      }
    },
    "defaults": {
      "type": "object",
      "description": "RECOMMENDED resources and exposure. Deployment-time config (porter run / instance config) always overrides these — CPU/RAM/disk are not baked into the image.",
      "properties": {
        "cpu": { "type": "integer", "minimum": 1 },
        "ramMb": { "type": "integer", "minimum": 128 },
        "diskGb": { "type": "integer", "minimum": 1 },
        "ports": { "type": "array", "items": { "type": "integer" } },
        "volumes": { "type": "array", "items": { "type": "string" } },
        "health": { "type": "string", "description": "Health check command run inside the guest." }
      }
    },
    "versions": {
      "type": "array",
      "minItems": 1,
      "items": {
        "type": "object",
        "required": ["tag"],
        "properties": {
          "tag": {
            "type": "string",
            "description": "The common version tag, shared with the upstream image where one exists (e.g. '1.29-alpine'). Same tag anyone using plain Docker/OCI would reference."
          },
          "overrides": { "$ref": "#/properties/defaults" },
          "status": { "type": "string", "enum": ["stable", "beta", "deprecated"], "default": "stable" }
        }
      }
    }
  }
}
