{
  "schemaVersion": "1",
  "name": "firecracker",
  "title": "Firecracker Official",
  "description": "Official Firecracker microvm image (kernel + rootfs from firecracker-microvm CI releases) — the reference base for bring-up and boot testing.",
  "type": "base",
  "category": "base",
  "official": true,
  "arch": ["x86_64"],
  "source": { "kind": "github-release", "reference": "firecracker-microvm/firecracker" },
  "defaults": { "ramMb": 256, "diskGb": 1 },
  "versions": [
    { "tag": "microvm", "status": "stable" }
  ]
}
