{
  "schemaVersion": "1",
  "name": "ubuntu",
  "title": "Ubuntu",
  "description": "Full Ubuntu base with systemd and glibc — the compatibility choice for heavier workloads.",
  "type": "base",
  "category": "base",
  "official": true,
  "arch": ["x86_64"],
  "source": { "kind": "docker-hub", "reference": "docker.io/library/ubuntu" },
  "defaults": { "ramMb": 512, "diskGb": 2 },
  "versions": [
    { "tag": "24.04", "status": "stable" },
    { "tag": "22.04", "status": "stable" }
  ]
}
